{
  "$schema": "https://json-schema.org/draft/2020-12/schema",
  "$id": "https://regie.selfizee.com/schemas/transactions.v1.schema.json",
  "title": "Lot de transactions borne — v1 (schéma 1.1)",
  "description": "Envoyé par une borne (toutes gammes) sur POST /ingest/v1/transactions. Un lot contient 1 à 500 transactions. Idempotent : la clé (borne_id, transaction_id) est unique, renvoyer un lot déjà reçu ne crée rien.",
  "type": "object",
  "additionalProperties": false,
  "required": [
    "schema_version",
    "borne_id",
    "envoye_le",
    "logiciel_version",
    "transactions"
  ],
  "properties": {
    "schema_version": {
      "enum": [
        "1.0",
        "1.1"
      ],
      "description": "1.1 ajoute des statuts, moyens et champs facultatifs ; les lots 1.0 restent acceptés."
    },
    "borne_id": {
      "description": "Identifiant unique de la borne, doit correspondre à la clé API utilisée.",
      "type": "string",
      "pattern": "^[A-Z0-9][A-Z0-9_-]{2,63}$"
    },
    "envoye_le": {
      "$ref": "#/$defs/horodatage"
    },
    "logiciel_version": {
      "type": "string",
      "minLength": 1,
      "maxLength": 32
    },
    "rattrapage": {
      "description": "true quand la borne renvoie un historique après une période hors ligne.",
      "type": "boolean",
      "default": false
    },
    "transactions": {
      "type": "array",
      "minItems": 1,
      "maxItems": 500,
      "items": {
        "$ref": "#/$defs/transaction"
      }
    }
  },
  "$defs": {
    "horodatage": {
      "description": "RFC 3339 avec fuseau explicite obligatoire (Z ou ±hh:mm).",
      "type": "string",
      "format": "date-time",
      "pattern": "^\\d{4}-\\d{2}-\\d{2}T\\d{2}:\\d{2}:\\d{2}(\\.\\d{1,6})?(Z|[+-]\\d{2}:\\d{2})$"
    },
    "transaction": {
      "type": "object",
      "description": "Aucune donnée carte (PAN, date d'expiration, nom du porteur) n'est acceptée : additionalProperties=false.",
      "additionalProperties": false,
      "required": [
        "transaction_id",
        "horodatage",
        "montant_ttc_centimes",
        "devise",
        "statut",
        "module",
        "moyen_paiement",
        "produit"
      ],
      "properties": {
        "transaction_id": {
          "description": "Identifiant unique et stable pour la borne, jamais réutilisé (ex. S513-20261005-K7PX2M-1 : borne, jour, code séance, rang du paiement dans la séance).",
          "type": "string",
          "minLength": 1,
          "maxLength": 128
        },
        "horodatage": {
          "$ref": "#/$defs/horodatage"
        },
        "montant_ttc_centimes": {
          "description": "Montant TTC en centimes (entier, positif ou nul). 800 = 8,00 €. Positif y compris pour un remboursement ; 0 pour une séance gratuite (moyen « aucun »).",
          "type": "integer",
          "minimum": 0,
          "maximum": 100000
        },
        "taux_tva_pct": {
          "description": "Optionnel. Taux de TVA appliqué ; à défaut, le taux configuré côté plateforme (20 %).",
          "type": "number",
          "minimum": 0,
          "maximum": 100
        },
        "devise": {
          "type": "string",
          "pattern": "^[A-Z]{3}$",
          "default": "EUR"
        },
        "statut": {
          "type": "string",
          "enum": [
            "accepte",
            "refuse",
            "annule",
            "expire",
            "offert",
            "rembourse"
          ],
          "description": "accepte : paiement accepté et enregistré ; refuse : refus banque ; annule : renoncement de l'invité ou abandon terminal avant impression ; expire : aucune réponse du terminal (ni refus ni annulation) ; offert : accepté et imprimé mais enregistrement abandonné, aucun débit (pas de CA) ; rembourse : saisi en back-office, jamais envoyé par la borne."
        },
        "transaction_origine_id": {
          "description": "Pour un remboursement ou une annulation postérieure : transaction_id de la vente d'origine.",
          "type": "string",
          "maxLength": 128
        },
        "module": {
          "type": "object",
          "additionalProperties": false,
          "required": [
            "type"
          ],
          "properties": {
            "type": {
              "description": "Code du référentiel « type de module ». Un code inconnu est rejeté en file d'erreurs.",
              "type": "string",
              "pattern": "^[A-Z0-9_]{2,64}$",
              "examples": [
                "HEXAPAY",
                "STRIPE_QR",
                "INGENICO_SELF_2000",
                "MONNAYEUR"
              ]
            },
            "numero_serie": {
              "type": "string",
              "maxLength": 64
            }
          }
        },
        "moyen_paiement": {
          "type": "string",
          "enum": [
            "cb",
            "sans_contact",
            "especes",
            "mobile",
            "web",
            "aucun",
            "autre"
          ],
          "description": "web : paiement sur téléphone par QR (Stripe) ; mobile : Apple Pay / Google Pay sur un terminal ; aucun : séance à 0 € ; autre : moyen inconnu (ticket non retrouvé)."
        },
        "reference_monetique": {
          "description": "N° d'autorisation du ticket (terminal) ou identifiant de paiement Stripe (pi_…) : clé du rapprochement. Jamais de numéro de carte.",
          "type": "string",
          "maxLength": 128
        },
        "produit": {
          "type": "object",
          "additionalProperties": false,
          "required": [
            "code",
            "nb_tirages"
          ],
          "properties": {
            "code": {
              "type": "string",
              "minLength": 1,
              "maxLength": 64,
              "description": "TIRAGE, TIRAGE_EXTRA (paiement supplémentaire de la séance), NUMERIQUE (photo livrée en numérique seul, 0 tirage), POSTAL (tirage expédié) ; autres codes acceptés."
            },
            "libelle": {
              "type": "string",
              "maxLength": 128
            },
            "nb_tirages": {
              "type": "integer",
              "minimum": 0,
              "maximum": 100,
              "description": "Tirages payés, figés à l'envoi. 0 possible (NUMERIQUE)."
            }
          }
        },
        "encaissement": {
          "type": "string",
          "enum": [
            "confirme",
            "incertain"
          ],
          "description": "Avec « accepte » seulement. incertain : enregistrement demandé sans réponse du terminal et sans ticket retrouvé ; compté dans le CA, signalé au rapprochement."
        },
        "motif": {
          "type": "string",
          "enum": [
            "invite",
            "banque",
            "terminal"
          ],
          "description": "Précise annule (invite / terminal), expire (terminal) ou refuse (banque)."
        },
        "reference_sequence": {
          "type": "string",
          "maxLength": 32,
          "description": "N° de séquence du terminal, facultatif."
        },
        "gratuite": {
          "type": "string",
          "enum": [
            "mode_gratuit",
            "code_staff",
            "degrade",
            "reimpression",
            "sans_tirage"
          ],
          "description": "Séance à 0 € : borne en mode gratuit, déblocage par code staff, tirage offert sur terminal en panne, réimpression staff, ou photo enregistrée sans tirage ni paiement (sans_tirage : voie numérique seule ou « non merci » sur l'offre ; avenant ventes n° 2)."
        },
        "pikcloud_uuid": {
          "type": "string",
          "pattern": "^[0-9a-fA-F]{8}-?[0-9a-fA-F]{4}-?[0-9a-fA-F]{4}-?[0-9a-fA-F]{4}-?[0-9a-fA-F]{12}$",
          "description": "Identifiant de la photo côté PikCloud (photo_uuid), UUID avec ou sans tirets, facultatif : sert à afficher la photo de la vente."
        },
        "carte_fin": {
          "type": "string",
          "pattern": "^[0-9]{4}$",
          "description": "Quatre derniers chiffres de la carte, lus sur le ticket du terminal (avenant ventes n° 2). Seulement avec cb ou sans_contact, quand le ticket a été rapproché de la séance."
        }
      },
      "allOf": [
        {
          "if": {
            "properties": {
              "statut": {
                "const": "rembourse"
              }
            }
          },
          "then": {
            "required": [
              "transaction_origine_id"
            ]
          }
        },
        {
          "if": {
            "properties": {
              "moyen_paiement": {
                "enum": [
                  "especes",
                  "aucun"
                ]
              }
            }
          },
          "then": {
            "not": {
              "required": [
                "reference_monetique"
              ]
            }
          }
        },
        {
          "if": {
            "required": [
              "encaissement"
            ]
          },
          "then": {
            "properties": {
              "statut": {
                "const": "accepte"
              }
            }
          }
        },
        {
          "if": {
            "required": [
              "gratuite"
            ]
          },
          "then": {
            "properties": {
              "moyen_paiement": {
                "const": "aucun"
              }
            }
          }
        },
        {
          "if": {
            "properties": {
              "moyen_paiement": {
                "const": "aucun"
              }
            },
            "required": [
              "moyen_paiement"
            ]
          },
          "then": {
            "properties": {
              "montant_ttc_centimes": {
                "const": 0
              },
              "statut": {
                "const": "accepte"
              }
            }
          }
        },
        {
          "if": {
            "required": [
              "carte_fin"
            ]
          },
          "then": {
            "properties": {
              "moyen_paiement": {
                "enum": [
                  "cb",
                  "sans_contact"
                ]
              }
            }
          }
        }
      ]
    }
  }
}
